<?xml version="1.0" encoding="UTF-8"?>
<!DOCTYPE pedidos SYSTEM "pedidos_Hito2_V2.dtd">
<?xml-stylesheet type="text/xsl" href="pedidos_Hito2_prod_tri1_2021.xsl"?>
<pedidos>
  <!-- Año 2021 -->
  <anio año="2021">
    <!-- Trimestre 1 -->
    <trimestre numero="1">
      <!-- 10 pedidos (5 clientes recurrentes) -->
      <!-- Pedido 1 -->
      <pedido>
        <!-- Detalles del cliente -->
        <cliente>
          <nombre>Maria</nombre>
          <apellidos>Gomez</apellidos>
          <telefono>987654321</telefono>
          <direccion>
            <calle>Avenida Principal</calle>
            <ciudad>Madrid</ciudad>
            <!-- Detalles del pedido -->
            <!-- Detalles del pedido -->
            <!-- Detalles del pedido -->
            <codigo_postal>28001</codigo_postal>
            <provincia>Madrid</provincia>
          </direccion>
          <correo_electronico>maria.gomez@example.com</correo_electronico>
          <fecha_inclusion>2021-01-05</fecha_inclusion>
        </cliente>
        <!-- Detalles del pedido -->
        <detalle_pedido>
          <numero_pedido>001</numero_pedido>
          <fecha_compra>2021-01-10</fecha_compra>
          <fecha_entrega>2021-01-25</fecha_entrega>
          <total_factura>200.00</total_factura>
          <!-- Productos -->
          <productos>
            <producto>
              <nombre>Monitor ASUS</nombre>
              <referencia>MON001</referencia>
              <precio>150.00</precio>
              <unidades>1</unidades>
            </producto>
            <producto>
              <nombre>Teclado Logitech</nombre>
              <referencia>TEC002</referencia>
              <precio>50.00</precio>
              <unidades>1</unidades>
            </producto>
          </productos>
        </detalle_pedido>
      </pedido>
      <pedido>
        <cliente>
          <nombre>Javier</nombre>
          <apellidos>Ruiz</apellidos>
          <telefono>654321987</telefono>
          <direccion>
            <calle>Calle Gran Vía</calle>
            <ciudad>Barcelona</ciudad>
            <codigo_postal>08002</codigo_postal>
            <provincia>Barcelona</provincia>
          </direccion>
          <correo_electronico>javier.ruiz@example.com</correo_electronico>
          <fecha_inclusion>2021-01-08</fecha_inclusion>
        </cliente>
        <detalle_pedido>
          <numero_pedido>002</numero_pedido>
          <fecha_compra>2021-01-12</fecha_compra>
          <fecha_entrega>2021-01-28</fecha_entrega>
          <total_factura>120.00</total_factura>
          <productos>
            <producto>
              <nombre>Ratón inalámbrico</nombre>
              <referencia>RAT003</referencia>
              <precio>40.00</precio>
              <unidades>1</unidades>
            </producto>
            <producto>
              <nombre>Altavoces Logitech</nombre>
              <referencia>ALT004</referencia>
              <precio>80.00</precio>
              <unidades>1</unidades>
            </producto>
          </productos>
        </detalle_pedido>
      </pedido>
      <pedido>
        <cliente>
          <nombre>Carlos</nombre>
          <apellidos>García</apellidos>
          <telefono>876543210</telefono>
          <direccion>
            <calle>Calle Serrano</calle>
            <ciudad>Madrid</ciudad>
            <codigo_postal>28006</codigo_postal>
            <provincia>Madrid</provincia>
          </direccion>
          <correo_electronico>carlos.garcia@example.com</correo_electronico>
          <fecha_inclusion>2020-12-20</fecha_inclusion>
        </cliente>
        <detalle_pedido>
          <numero_pedido>010</numero_pedido>
          <fecha_compra>2021-01-15</fecha_compra>
          <fecha_entrega>2021-02-01</fecha_entrega>
          <total_factura>180.00</total_factura>
          <productos>
            <producto>
              <nombre>Teclado gaming</nombre>
              <referencia>TEC011</referencia>
              <precio>100.00</precio>
              <unidades>1</unidades>
            </producto>
            <producto>
              <nombre>Mousepad XXL</nombre>
              <referencia>MP012</referencia>
              <precio>80.00</precio>
              <unidades>1</unidades>
            </producto>
          </productos>
        </detalle_pedido>
      </pedido>
      <!-- Pedido 3 -->
      <pedido>
        <cliente>
          <nombre>Ana</nombre>
          <apellidos>Fernández</apellidos>
          <telefono>789012345</telefono>
          <direccion>
            <calle>Calle Alcalá</calle>
            <ciudad>Madrid</ciudad>
            <codigo_postal>28009</codigo_postal>
            <provincia>Madrid</provincia>
          </direccion>
          <correo_electronico>ana.fernandez@example.com</correo_electronico>
          <fecha_inclusion>2021-01-10</fecha_inclusion>
        </cliente>
        <detalle_pedido>
          <numero_pedido>003</numero_pedido>
          <fecha_compra>2021-01-15</fecha_compra>
          <fecha_entrega>2021-01-30</fecha_entrega>
          <total_factura>80.00</total_factura>
          <productos>
            <producto>
              <nombre>Auriculares Bluetooth</nombre>
              <referencia>AUR004</referencia>
              <precio>40.00</precio>
              <unidades>1</unidades>
            </producto>
            <producto>
              <nombre>Cable USB-C</nombre>
              <referencia>CAB005</referencia>
              <precio>40.00</precio>
              <unidades>1</unidades>
            </producto>
          </productos>
        </detalle_pedido>
      </pedido>
      <pedido>
        <cliente>
          <nombre>Luis</nombre>
          <apellidos>Ramírez</apellidos>
          <telefono>876543210</telefono>
          <direccion>
            <calle>Rambla de Catalunya</calle>
            <ciudad>Barcelona</ciudad>
            <codigo_postal>08007</codigo_postal>
            <provincia>Barcelona</provincia>
          </direccion>
          <correo_electronico>luis.ramirez@example.com</correo_electronico>
          <fecha_inclusion>2021-01-12</fecha_inclusion>
        </cliente>
        <detalle_pedido>
          <numero_pedido>004</numero_pedido>
          <fecha_compra>2021-01-18</fecha_compra>
          <fecha_entrega>2021-02-02</fecha_entrega>
          <total_factura>120.00</total_factura>
          <productos>
            <producto>
              <nombre>Impresora multifunción</nombre>
              <referencia>IMP006</referencia>
              <precio>80.00</precio>
              <unidades>1</unidades>
            </producto>
            <producto>
              <nombre>Pendrive 64GB</nombre>
              <referencia>PEN007</referencia>
              <precio>40.00</precio>
              <unidades>1</unidades>
            </producto>
          </productos>
        </detalle_pedido>
      </pedido>
      <!-- Pedido 5 -->
      <pedido>
        <cliente>
          <nombre>Laura</nombre>
          <apellidos>Martínez</apellidos>
          <telefono>765432109</telefono>
          <direccion>
            <calle>Avenida Diagonal</calle>
            <ciudad>Barcelona</ciudad>
            <codigo_postal>08019</codigo_postal>
            <provincia>Barcelona</provincia>
          </direccion>
          <correo_electronico>laura.martinez@example.com</correo_electronico>
          <fecha_inclusion>2021-01-20</fecha_inclusion>
        </cliente>
        <detalle_pedido>
          <numero_pedido>005</numero_pedido>
          <fecha_compra>2021-01-25</fecha_compra>
          <fecha_entrega>2021-02-09</fecha_entrega>
          <total_factura>180.00</total_factura>
          <productos>
            <producto>
              <nombre>SSD 1TB</nombre>
              <referencia>SSD008</referencia>
              <precio>100.00</precio>
              <unidades>1</unidades>
            </producto>
            <producto>
              <nombre>Router inalámbrico</nombre>
              <referencia>ROUT009</referencia>
              <precio>80.00</precio>
              <unidades>1</unidades>
            </producto>
          </productos>
        </detalle_pedido>
      </pedido>
      <!-- Pedido 6 -->
      <pedido>
        <cliente>
          <nombre>Adrián</nombre>
          <apellidos>Sánchez</apellidos>
          <telefono>654321098</telefono>
          <direccion>
            <calle>Paseo de Gracia</calle>
            <ciudad>Barcelona</ciudad>
            <codigo_postal>08008</codigo_postal>
            <provincia>Barcelona</provincia>
          </direccion>
          <correo_electronico>adrian.sanchez@example.com</correo_electronico>
          <fecha_inclusion>2021-01-22</fecha_inclusion>
        </cliente>
        <detalle_pedido>
          <numero_pedido>006</numero_pedido>
          <fecha_compra>2021-01-28</fecha_compra>
          <fecha_entrega>2021-02-13</fecha_entrega>
          <total_factura>220.00</total_factura>
          <productos>
            <producto>
              <nombre>Impresora láser</nombre>
              <referencia>IMP010</referencia>
              <precio>120.00</precio>
              <unidades>1</unidades>
            </producto>
            <producto>
              <nombre>Teclado mecánico</nombre>
              <referencia>TEC011</referencia>
              <precio>100.00</precio>
              <unidades>1</unidades>
            </producto>
          </productos>
        </detalle_pedido>
      </pedido>
      <!-- Pedido 7 -->
      <pedido>
        <cliente>
          <nombre>Pablo</nombre>
          <apellidos>Rodríguez</apellidos>
          <telefono>890123456</telefono>
          <direccion>
            <calle>Calle Larios</calle>
            <ciudad>Sevilla</ciudad>